{
  "schema_version": "1",
  "event_id": "00000000-0000-4000-8000-000000000009",
  "run_id": "00000000-0000-4000-8000-000000000002",
  "run_sequence": 1,
  "execution_id": "00000000-0000-4000-8000-000000000001",
  "epoch": 1,
  "sequence": 1,
  "type": "started",
  "time": "2026-10-10T00:00:00Z",
  "payload": {
    "provider": "mock"
  }
}
